,title,company,field,location,description,salary,gpa_req
256,TeleSales,Amazon,software,munich,"At itopia, #URL_a17c109f61d520833d50496e363a8f8b549fa3efcba6fc0510c8d80a62801070#,  the successful Sales Representative candidate will manage outbound sales calls for itopia’s  line of Virtual Desktops, Hosted QuickBooks and our SaaS Enablement platform sold to SMB, Law Firms, Accountants, and Independent Software Vendors.  The candidate we are looking for will effectively relate our value proposition to our valued prospects and customers. ",61000,3.8
257,Executive Creative Director,Matrox,software,paris,"As the Executive Creative Director at Mutual Mobile, you’ll be the senior most person on our Design team. You will inspire and mentor our team of 30+ Visual and Interaction Designers.A little about us:Our designers and engineers work together (literally side-by-side, everyday) to build   engaging mobile experiences. Delighting users is our #1 priority, and we want someone to lead our team that shares this passion.We hate to brag, but we’re working on some pretty cool sh*t. We’d love to tell you more about it. We’re in the services space so unfortunately that means we can’t show our coolest work online.",80000,2.5
258,VP Sales - B2B SaaS Startup,Matrox,general,kiev,"About Jhana: The mission that gets us out of bed in the morning is simple but not easy: Help people be more successful at work.To achieve this goal we’ve assembled a high-performing team of entrepreneurs, sales and customer success champions, and deep thinkers who get really excited about ideas and learning. Together, we’re creating and supporting an online resource to help new managers become good managers — a result that not only benefits them, but also their teams and organizations. With over 20 delighted customers (including Facebook, Groupon, Eventbrite, #URL_ad81be50f07523d973076e5fd370e1751cac7ac4984df500e9c8a222efaa0fa4#, Modcloth and SolarCity) and very high renewal rates, we’re well on our way to building a long-term company. To learn more check out our team and product.About the role: As Jhana’s VP of Sales, you’ll build an enduring company from the early days and run what is and will be the largest department at Jhana. We use a high-touch, inside sale, and you'll own all of sales and sales development. You'll help us continue our fast growth, partner with incredible customers, build our four-person sales team and relentlessly improve our processes to be a best-in-class sales operation.Your responsibilitiesHelp build a successful, long-term, mission-driven companyContinue the rapid growth and own the overall sales number, including new business, expansions and renewalsHire, manage, coach and motivate the sales and sales development team (Account Executives and Sales Development Representatives)Relentlessly improve and scale the sales processMember of Jhana’s executive team, reporting to the CEO",98000,3.0
259,"Hiring New and Experienced Truck Drivers - $3,000-10k Sign on bonus - Start Next Week",UnitedHealth Group,general,munich,We have solo and teams available.Some OTR and some Regional.Home weekly or longer on the road.$45-60k/year available with benefits.Experienced and New Drivers.Can have you in a truck next week. ,103000,3.2
260,DATA SCIENTIST,Apple,software,munich,"Benefits·  Job ResponsibilitiesDesign and develop statistical, data mining and machine learning algorithms and technologiesAnalyze and understand large amounts of historical data to detect patterns, to analyze trends and to identify correlationsEstablish scalable, efficient, automated processes for large scale data analyses, model development, model validation and model implementationCollaborate with other engineers or engineering teams to push the algorithms into productionWork with engineering and product teams distributed across multiple countries ",82000,3.3
261,"Account Executive - Redlands, CA",Cigna,software,new york,"THE COMPANY: ESRI – Environmental Systems Research Institute (#URL_6b9c7dbc8de6a3e168e9c45ac1289630f08cb59eabb68aeaa926cdb16af18c48#)Our passion for improving quality of life through geography is at the heart of everything we do.  Esri’s geographic information system (GIS) technology inspires and enables governments, universities and businesses worldwide to save money, lives and our environment through a deeper understanding of the changing world around them.Carefully managed growth and zero debt give Esri stability that is uncommon in today's volatile business world.  Privately held, we offer exceptional benefits, competitive salaries, 401(k) and profit-sharing programs, opportunities for personal and professional growth, and much more.THE OPPORTUNITY: Account ExecutiveAs a member of the Sales Division, you will work collaboratively with an account team in order to sell and promote adoption of Esri’s ArcGIS platform within an organization. As part of an account team, you will be responsible for facilitating the development and execution of a set of strategies for a defined portfolio of accounts. When executing these strategies you will utilize your experience in enterprise sales to help customers leverage geospatial information and technology to achieve their business goals. Specifically…Prospect and develop opportunities to partner with key stakeholders to envision, develop, and implement a location strategy for their organizationClearly articulate the strength and value proposition of the ArcGIS platformDevelop and maintain a healthy pipeline of opportunities for business growthDemonstrate a thoughtful understanding of insightful industry knowledge and how GIS applies to initiatives, trends, and triggersUnderstand the key business drivers within an organization and identify key business stakeholdersUnderstand your customers’ budgeting and acquisition processesSuccessfully execute the account management process including account prioritization, account resourcing, and account planningSuccessfully execute the sales process for all opportunitiesLeverage and lead an account team consisting of sales and other cross-divisional resources to define and execute an account strategyEffectively utilize and leverage the CRM to manage opportunities and drive the buying processPursue professional and personal development to ensure competitive knowledge of the real estate industryLeverage social media to successfully prospect and build a professional networkParticipate in trade shows, workshops, and seminars (as required)Support visual story telling through effective whiteboard sessionsBe resourceful and takes initiative to resolve issues",100000,3.3
262,Truck Driver - CDL Truck Driver - Truck Driving Jobs,Exxon Mobil,general,montreal,"FAIRCHILD FREIGHT LLC. NEEDS TEN (10) OWNER OPERATORS FOR POWER ONLY :These shipments are all POWER ONLY, towing 53' dry vans mainly intrastate Utah. Drivers will be dispatched statewide.All trucks will start in Hurricane, Utah. Driver must be available (and have hours for) minimum 3 consecutive days. Drivers may be asked to extend based on freight demands and the driver's available hours. Drivers will always terminate back in Hurricane, UT upon completion.We do require non-owned trailer/ trailer interchange insurance coverage of minimum $50,000. Drivers must be fluent in English, and have a professional appearance (no sweat pants, tank tops, flip flops, etc.). Drivers will need to attend a brief safety orientation once arriving for work on the first day, this will take approximately 1 hour.This program will be YEAR-ROUND with surges in volume.The program pays $2 per mile (on odometer miles) with a guaranteed minimum of $800 per day. Meaning, if a truck works all day but drives 200 miles, you will not make less than $800 per day. With the 3 day commitment, we guarantee you will make at minimum $2400 for the 3 days. However, if you are unable to complete the 3 days (breakdown, driver time off, etc.), you will only be paid on the work completed.We have a few opening for drivers starting tomorrow through Friday. Spots are filling fast!!!",90000,4.0
263,Office Manager,genetec,general,bucharest,"About the CompanyWe are ticketscript - the European market leaders in digital self-ticketing. Whether it’s massive dance events, festivals, gigs, outdoor cinemas, fairs, theater shows, exhibitions, comedy nights, or award ceremonies - we do them all! We believe in empowering our customers. Their success is our success. So far over 50,000 events have worked with us - and this is only the beginning. We have offices in London, Amsterdam, Antwerp, Berlin and Barcelona and are rapidly expanding across Europe.The roleThe office manager organises and supervises all of the administrative activities that facilitate the smooth running of an office. The successful candidate will ensure employees are well served and assist in operating the office effectively. Interactions with all internal and external contacts must be graciously and cordially stewarded. The successful candidate will be based in our central Berlin office.ResponsibilitiesInventory of hardware and movable property with purchase date;Effective control of all incoming and outgoing calls and managing;Opens, sorts and distributes incoming mail and manages what mail should be sent to the account of our head office in Amsterdam;Coordination of conference room(s) schedule and prepare for meetings;Provides visitors and/or management team with refreshments during meetings and lunch when needed;Responsible for drafting routing forms and if necessary a cover letter;Set up new employee work space and train procedures;Organising the office lay out and maintaining supplies of stationery and equipment;Maintaining the condition of the office and arranging for necessary repairs;General project and cost saving exercises;Partner with HR for new hire onboarding coordination;Manage space allocation for new employees.",118000,2.8
264,Front End/Web Developer ,Berkshire Hathaway,software,bucharest,"About the roleOur marketing team is growing and they need the support of a full time web developer to help them produce all the public facing aspects of Intercom. You'll work as part of our frontend/interface team, and alongside all our product engineers and designers. Your work will be visible to thousands of people everyday, and will be instrumental to our long term success. You will:Drive innovation by coming up with new and exciting ideas to creatively solve issuesCollaborate with marketers, designers, and developers in a fast paced environmentProactively look for opportunities to improve the design, interface, and backend of our websiteWork with marketing leadership and others to create beautifully simple technical solutionsObsess about the beauty of what you produce and how your produce it.Intercom:Intercom (#URL_cb674f93cbcd215a3a0a57a8615a565545949eead8adbbc73307c26d6a6af81b#) is a simple, personal messaging service for businesses and their customers. It provides a single, integrated platform for the whole company to use for support, marketing, product, sales communication and more.We’re on a mission to make web and mobile business personal. We believe that the future of customer communication requires not increasingly complex, impersonal point solutions, but rather a simple, seamless platform that applies innovations found in consumer services like Facebook and WhatsApp.Founded in late 2011, Intercom has raised over $30 million in venture capital and is backed by leading investors, The Social+Capital Partnership and Bessemer Venture Partners. Intercom has been adopted by thousands of businesses, including Heroku, Hootsuite, Rackspace, Yahoo! and Perfect Audience. Our customers love the product: #URL_18cc302f4e0f1dac521853b2a6ae109ebbe44c6130d31eb0413535ba71e2f42f#We like big thinkers with small egos who believe in our goal to build a uniquely impactful, long-lasting tech company. Our vision is to fundamentally change forever how Internet businesses and their customers communicate.",97000,3.2
265,Oracle Discoverer,genetec,general,london,Job Title: Oracle Discoverer ExpertDuration: Long termOne of our clients is looking for an Oracle Discoverer expert. Do you know Oracle Discoverer well? Both Admin and Desktop in Oracle EBS 12 environment. Long term contract in San Francisco.,65000,2.5
266,"Order Processing Coordinator @ PGI, a Food Production Company",UnitedHealth Group,general,kiev,"November, 2014Pure Ground Ingredients (PGI)in Carson CityPGI is a fast growing organic herb/spice/botanicals importing and production company that utilizes extensive food safety, handling and management practices to insure a quality product. We currently have a number of open positions in our shipping, warehouse and production operations.Order Processing CoordinatorOffice generalist to support our Order Processing Manager. Tasks include: - Schedule trucking pickups- Process and manage BOLs- Process and package food samples for suppliers- Review orders at various stages of internal processing for errors and adjustments, etc.- Interface with shipping, warehousing and food production personnelAll applicants must submit to drug and background screening.Company is an Equal Opportunity Employer.",72000,3.5
267,Business Development Manager,genetec,software,montreal,"BackgroundBallparc is a venture-backed startup on the forefront of tackling problems facing the $9 billion parking industry. Our cloud-based, mobile-enabled solutions provide parking operators with better information to run their businesses more effectively and profitably.In order to go after this large opportunity and grow our innovative solutions, we are seeking an experienced, passionate Business Development Manager. Reporting directly to the President and Co-Founder, the Business Development Manager has the opportunity to shape our product sales strategy. The Business Development Manager builds key customer relationships, identifies business opportunities, negotiates and closes contracts, and maintains extensive knowledge of market conditions. This full-time position may require extensive travel.Knowledge, Skills, and AbilitiesThe ideal candidate is a self-starter driven by interacting with prospects, demonstrating how our parking solutions can improve operations, and ultimately closing deals. The ideal candidate also has at least 1-2 years of proven sales experience and is seeking to take ownership and responsibility for driving sales within a young, growing startup.Strong communication, research, and negotiation skills are required. Applicants must also have basic financial knowledge and competency with Microsoft Word, Excel, and PowerPoint. Salesforce experience is a plus.EducationA Bachelor's degree is required for this position.ResponsibilitiesNew Business DevelopmentProspect for new clients by networking, cold-calling, and advertisingAttend and present at industry association events and conferencesResearch and plan approaches to convince prospects to use Ballparc solutionsDevelop proposals which address clients' needs, concerns, and objectivesDemonstrate product benefits and features to prospectsNegotiate agreements and fees with clientsPartnershipsCultivate partnerships with industry distributors, hardware and software providers, and other strategic prospectsDevelop and manage the company's reseller programManagement and PlanningUsing knowledge of the market and competitors, identify and develop the company's differentiatorsIdentify opportunities for campaigns and marketing channels that will increase salesEnsure that leads, opportunities, and activities are entered accurately into SalesforceForecast sales goals and projected revenuePrepare reports and summaries on sales progress and performance",96000,2.7
268,Native English speaking Account Manager,thirdBridge,general,kiev,"Optimy is a fast-growing company that develops and sells a unique software (as a SaaS web-application) for sponsorship, partnership and grant management. The Optimy software helps brands and foundations to optimise performance across the lifecycle of a project.Our Optimy users are market leaders in their sector, and include BNP Paribas Fortis, BMW, L'Oréal, ING, Volvo, Carrefour, Unipol Gruppo, Audi, Décathlon, GDF Suez and many others.Thanks to our rapid expansion, Optimy is currently looking for a native English speaking account manager. The successful candidate will work from the Head Office in Brussels. Your Mission:Developing new countries and marketsGenerating new businessNegotiating contractsBuilding long-term customer relationships",93000,2.9
269,Aberdeen DGV Apprenticeships Under NAS 18 Year Olds Only,Walmart,general,paris,You must be 18 years old to apply for this position due to government funding and the vehicle you will be driving.Through this apprenticeship you will gain a Class 2 license.This is a fantastic opportunity for those looking to start their careers as a driver. During the first 12 months you will work towards a Level 2 Driving Goods Vehicle NVQ and then be kept on in a permanent position.You will be working for a nationwide delivery company and the role will involve:-Collecting and delivering parcels-Reporting to traffic manager-Loading and uploadingYou must have a clean UK driving license to apply for this position.If you have a desire to work in this industry and are punctual and trustworthy please apply now.,85000,2.8
270,Human Resources Coordinator,Microsoft,general,kiev,"HealthCare California, the central valley’s premier home health agency, seeks a Human Resources (HR) Coordinator for it expanding operations.The successful HR Coordinator is a proactive self-starter who will learn line and staff functions, operations, company policies and practices affecting each phase of the company.  Principal Job Functions Conducts new hire orientation for all new staff Maintains HR files and key company documentsProcess bi-weekly PayrollEnsures Paychex employment database remains currentAdministers fleet vehicle programCoordinates open enrollment &amp; administers health benefits plan additions or changesManages leave of absence, worker's compensation and OSHA complianceMaintain and assigned mobile device inventory   Reports on key employment dates and benchmarksEnsures company policies remain current and updated",76000,2.9
271,Customer Service Associate ,Costco,general,paris," The Customer Service Associate will be based in Calgary, Alberta. The right candidate will be an integral part of our talented team, supporting our continued growth.Responsibilities:Perform various Mail Center activities (sorting, metering, folding, inserting, delivery, pickup, etc.)Lift heavy boxes, files or paper when neededMaintain the highest levels of customer care while demonstrating a friendly and cooperative attitudeDemonstrate flexibility in satisfying customer demands in a high volume, production environmentConsistently adhere to business procedure guidelinesAdhere to all safety proceduresTake direction from supervisor or site managerMaintain all logs and reporting documentation; attention to detailParticipate in cross-training and perform other duties as assigned (Filing, outgoing shipments, etc)Operating mailing, copy or scanning equipmentShipping &amp; ReceivingHandle time-sensitive material like confidential, urgent packagesPerform other tasks as assignedScanning incoming mail to recipientsPerform file purges and pullsCreate files and ship filesProvide backfill when neededEnter information daily into spreadsheetsIdentify charges and match them to billingSort and deliver mail, small packages",82000,3.7
272,Financial Advisor Assistant ,Costco,finance,tokyo,"Job DescriptionIn New York Life, you can grow your own business and make a difference in your community. Moreover, New York Life provides comprehensive and ongoing professional training and development, state-of-the-art marketing and sales solutions, and a clearly defined career path.  Responsibilities•Develop and implement business and marketing plans•Prospect for potential clients •Discuss financial concerns and needs of individuals•Present potential solutions using our world class suite of products and services ",107000,3.9
273,Marketing Support Manager,Chevron,general,montreal,"The Marketing Support Manager will provide comprehensive sales, marketing and customer contact support to enable CSD’s new and developing business lines, including for CSD’s Mobile Technology Reseller Program, Captioning Services, Workplace Solutions and other new and developing initiatives.  This position will develop, create and support targeted sales campaigns and promotions to ensure the successful launch and sustainability of new and emerging revenue opportunities for CSD.Essential FunctionsImplement comprehensive marketing campaigns and promotions creating sales support materials, brochures, contact sheets and broadcast mailshots and follow-up scripts.Identify precise target audience, key message and main selling points to each prospect group and define specific desired consumer response to each campaign.   Draw up Campaign Briefs (goals, target audience, medium used) that inform all internal stakeholders, including CSD Executive, Business Development, Customer Experience and National Marketing about campaign purpose, timing and desired outcomes.Monitor, measure and document trends and results of scheduled campaign initiatives, ensuring all campaigns and follow-up prospecting activities are on-schedule.Support training of CSD Customer Experience and Business Development Teams on implementing sales initiatives and prospect follow-up assignments.  Oversee and grow CSD’s Emerging Market prospect database, including obtaining and scrubbing contact lists and promoting conversions of “cold” prospects to viable leads.Provide reporting and actively monitor health of each campaign’s contribution to the sales pipeline, program ROI and customer / contact acquisition.Utilize web tools such as Signal Engage, Google Drive, WordPress and Survey Monkey to efficiently connect and engage prospects. Document viable new leads in #URL_24cd44edb473365624a280f26f00a589336e1282f129bebf1f212762aad60ece#.Streamline and measurably improve the lead and demand generation process cycle time.Regularly monitor and cull new leads from CSD social networking activity, including for the Director of Emerging Markets and self as we engage online groups, discussions, etc.Support Director of Emerging Markets in other marketing-related projects as assigned.",112000,3.7
274,Office Manager,Exxon Mobil,general,munich,"About the CompanyWe are ticketscript - the European market leaders in digital self-ticketing. Whether it’s massive dance events, festivals, gigs, outdoor cinemas, fairs, theater shows, exhibitions, comedy nights, or award ceremonies - we do them all! We believe in empowering our customers. Their success is our success. So far over 50,000 events have worked with us - and this is only the beginning. We have offices in London, Amsterdam, Antwerp, Berlin and Barcelona and are rapidly expanding across Europe.The roleThe office manager organises and supervises all of the administrative activities that facilitate the smooth running of an office. The successful candidate will ensure employees are well served and assist in operating the office effectively. Interactions with all internal and external contacts must be graciously and cordially stewarded. The successful candidate will be based in our central Berlin office.ResponsibilitiesInventory of hardware and movable property with purchase date;Effective control of all incoming and outgoing calls and managing;Opens, sorts and distributes incoming mail and manages what mail should be sent to the account of our head office in Amsterdam;Coordination of conference room(s) schedule and prepare for meetings;Provides visitors and/or management team with refreshments during meetings and lunch when needed;Responsible for drafting routing forms and if necessary a cover letter;Set up new employee work space and train procedures;Organising the office lay out and maintaining supplies of stationery and equipment;Maintaining the condition of the office and arranging for necessary repairs;General project and cost saving exercises;Partner with HR for new hire onboarding coordination;Manage space allocation for new employees.",115000,3.8
