,title,company,field,location,description,salary,gpa_req
372,Investment Sales Associate ,Costco,general,montreal,"Job Description: Associate - Investment Sales Sabre Real Estate Group is looking to grow its Investment Group with college graduates or real estate professionals looking for an exciting, new opportunity in commercial real estate investment sales.  The role, Associate - Investment Sales, will focus on sourcing and participating in commercial real estate investment transactions and building new business opportunities for Sabre Investment Group.  The Associate will succeed by developing relationships through over-the-phone contact and regular in-person meetings allowing Sabre to form a strong relationship with the potential client.  They will identify the client’s investment preferences allowing them to represent either the listing or purchase side of the real estate transaction. The ideal candidate for this position will be a self-starter and capable of focusing on small tasks in order to achieve a larger objective.  They will have a finance, marketing, or real estate background, giving them the fundamentals to evaluate investment property opportunities.  Other areas of focus include but are not limited to: sales, marketing, property valuation, contract negotiation, market research and due-diligence. Sabre Real Estate Group is a premiere commercial real estate brokerage firm in the NYC/Metro area.  Located in Garden City, NY, Sabre is uniquely positioned to recruit, train, and grow professionals with less than five years of experience in the commercial real estate field.Interested candidates will email their resume demonstrating experience in commercial real estate or a sales position in a financial field.  For recently graduated students, the resume should demonstrate relevant course work and/or internships focused on investment products.Our investment professionals are commission-only independent contractors.",73000,4.0
373,Agent-Inbound Sales Position,Exxon Mobil,general,new york,"IBEX Global is rapidly growing and we’re looking to quickly ramp up entry level Call Center Customer Service Representatives that will be responsible for taking inbound calls from clients, selling telecommunications products and services. At IBEX Global we’ve been delivering superior customer services for over 10 years, as a business process outsourcer offering an integrated suite of services that supports an expansive array of client facing solutions. representatives are responsible for generating sales of telecommunications products in an inbound sales center.Job ResponsibilitiesIn this role you will be responsible for fielding inbound calls from customers providing quality support and suggestively selling telecommunications products and services based on customer’s needs.Additional responsibilities of the position include:• Generating sales of our client’s services and products and representing IBEX Global and its clients with the utmost integrity and professionalism• Providing exceptional service and maintaining established acceptance rating on quality monitoring tests• Resolving customer concerns immediately and effectively, displaying professionalism and courtesy at all times• Having full knowledge of features and benefits of products and services; quickly and correctly answering product questions seeking to stay informed of program changes• Attending and actively participating in all required training programs; showing eagerness and capacity to learn new products and programs",97000,3.8
374,Product Marketing Manager,thirdBridge,general,montreal,"As a Product Marketing Manager, you will be responsible for the outbound marketing activities for your assigned products. You will craft the messaging and positioning for products and you'll conceive and develop innovative marketing programs that drive demand. Attention to detail and an eye for quality, along with the ability to grasp and translate technical capabilities into customer benefits is crucial. In your role as a Product Marketing Manager you will be the subject matter expert and have a key understanding of buyers, their buying criteria and will transfer that knowledge to the sales channel.",84000,2.5
375,Business Development Manager - Banking & Investment IT Solutions,DRW,software,new york,PROFILE is a world-class provider of Banking and Investment Management software with more than 20 years in the IT sector. (Website: #URL_423a91583a9e62899bf7b3be52d75d57b8e9518ef9b0783ec996513acdc3f627# )The company is looking for an experienced sales professional to further support its Geneva based office.,99000,2.6
376,Partnerships Coordinator,UnitedHealth Group,general,paris,"Super Soccer Stars is excited to offer a new, dynamic position based in our Manhattan Office: Partnerships Coordinator.  If you are a highly personable, smart, self-motivated individual comfortable in a fast-paced, rapidly growing environment, then this is the opportunity for you. Super Soccer Stars is the leading provider of athletic programs for youth, now operating in 9 locations in multiple cities, with a staff of over 50 full and 500 part time employees.  We are looking for a Partnerships Coordinator who will be responsible for the day-to-day management of our relationships with 200+ schools and facilities, ensuring flawless programming to over 1,000 children’s weekly soccer classes and events in the New York City area.Responsibilities include:Oversee and build the department, including management of the Partnerships Assistant and coordination with the Business Development Coordinator to create and develop new relationshipsManage day-to-day administrative tasks to ensure a fantastic experience to current customersProvide friendly and efficient communication with facility managers, school directors, and customers via phone, email and in personCreate strategic yearly schedule and calendar of all classes, camps and eventsCoordinate and execute administrative details to make classes and events come to life, including processing all permit and rental requests, creating and monitoring partnership classes, overseeing enrollment in partnership classes, and communicating details between departments and with school directorsCommunicate all administrative and procedural details to coaches regarding their classes at partnership locationsSchedule site visits to view prospective locations and partnerships, as well as to manage current relationships and supervise classesWork with Finance Department to review and approve invoices for permits, rentals, and coachesAssist with marketing efforts to promote classes and events to maximize enrollmentPlease submit a detailed and specific cover letter explaining why you would be the right person for this position, specifying salary history and requirements.  Be sure to also attach an updated version of your resume. Any application that does not include these elements will not be considered.",93000,3.2
377,UI ENGINEER MANAGER,Exxon Mobil,software,munich,"We are looking for a Software Engineering Manager, UI to join our product development team.  You will be responsible for collaborating with Product Management and building out the user experience for new products. Core functions include managing a development team to deliver high quality products.  You will actively participate on our team and help drive innovation for new products and services.",52000,3.3
378,English Teacher Abroad ,Amazon,Education,paris,"Play with kids, get paid for it Love travel? Jobs in Asia$1,500+ USD monthly ($200 Cost of living)Housing provided (Private/Furnished)Airfare ReimbursedExcellent for student loans/credit cardsGabriel Adkins : #URL_ed9094c60184b8a4975333957f05be37e69d3cdb68decc9dd9a4242733cfd7f7##URL_75db76d58f7994c7db24e8998c2fc953ab9a20ea9ac948b217693963f78d2e6b#12 month contract : Apply today ",78000,2.6
379,Senior Mortgage Underwriter,Walmart,general,tokyo,"Analyze information to determine risk involved in lending money for mortgage loans; responsible for analyzing/verifying income, assets, credit and all supporting documentation to ensure sufficient to loan standards and guidelines; includes verifying all documentation is correct, complete and in the loan file; that the information has been correctly calculated.  Provide direction and guidance to processing staff for documentation and processing quality; ensure file conforms to guidelines. Review appraisal to ensure value of collateral is sufficiently documented and appraiser has correctly completed forms. Assist in making decision to either deny loan or, depending on the loan’s attributes, approve loan or make recommendation to approve loan. Review underwriting decision, reasoning (logic), and conditions or counteroffer with appropriate parties. Keep current on regulations and policies and guidelines and on changes of agencies.Assume additional duties as they arise, cross-train within the department, and be responsive to the department.",56000,3.2
380,Middleweight Software Developer,Cigna,general,new york,"The ideal candidate will have a minimum of 1 years commercial experience and a qualification in this field. Working experience of MySQL is essential, experience of agile methodologies would be ideal and experience with modern web technologies, cloud architecture and/or embedded programming would be advantageous.We are Zeco Energy, a growing startup in the energy management sector; we're starting to grow our 11 strong team as we look to scale our systems and expand our product portfolio. We work with a wide range of companies and hardware providers, with some exceptionally large partners already on our side. This is an exciting opportunity to get into an ambitious big data company that is capitalising on a rapidly growing market.No specialist knowledge of the energy market is required, but some knowledge of the terminology and industry standards would be desirable. An ideal candidate will have working experience with C based languages and have a willingness to learn new languages and technologies.",55000,4.0
381,Marketing Manager - Berlin,Amazon,general,paris,"An army of loyalists has a militant vibe to it, but at Startup Institute, it is exactly what we aim to create. Through relevant content, engaging experiences, and full-on community immersion, you will lead the charge. Our approach to marketing is an evolving model blending digital acquisition with interpersonal engagement. As such, we are looking for heaping amounts of curiosity, perseverance, and emotional intelligence heavily, as well as a healthy dose of tech savvy.As Marketing Manager you will generate a backlog of customer demand by bringing individuals as close to the Startup Institute experience as possible. There are many channels to achieve this through, both online and offline. Online, you will work collaboratively across the company to coordinate effective campaigns. Offline, you will be uber visible in the community, flying our flag high. Our ability to connect with others is invaluable, and we hold this balance in the utmost regard.",61000,3.2
382,Mystery Shopper - Illinois,Alphabet,general,bucharest,"Can we rely on YOU? Would you like to get paid to use your smart phone or tablet?SDI Marketing's got the job for you!SDI Marketing is currently looking for dedicated candidates to complete Mystery Shops in high volume retail locations for one of our top-tier clients.We will be providing you with a checklist that you MUST complete through your tablet or smart phone. A data plan &amp; camera is required for each mystery shop.Various locations are available for you to complete each Mystery Shop. We offer a pay rate of $20.00 per store. The more store locations you complete, more for you!ALL mystery shops must be completed between May 16th - June 6th.The following locations are available:Perkin, ILBartonville, ILMorton, ILEast Peoria, ILWashington, ILChillicothe, ILStreator, ILOttawa, ILSterling, ILIf you would like to complete mystery shops in these locations, please provide us with a resume by replying to this Ad with the locations you can visit.",96000,2.7
383,General Manager - Indianapolis,Exxon Mobil,general,bucharest,"Shyp is looking for the best of the best to lead each city. General Managers run their city, as such, we rely on our GMs to make key decisions on the ground, foster Shyp's culture, and take direct ownership of growth and success. Our GMs are a blend of product manager, marketing guru, and logistics and supply chain expert with a past history of success as an entrepreneur and leader. General manager's lead the local ops team and are responsible for local strategy, onboarding the city team, building out facilities, maintaining the utmost quality of service, on the ground customer support and local PR/marketing.",58000,3.4
384,Accounting Clerk $15/hr,Walmart,general,munich,"The Accounting Clerk will work in a team environment providing general clerical, accounting and office support. Primary duties will include but are not limited to: data entry (both numerical and alphabetical) , filing, bank statement reconciliation. Generating client's monthly financial statements. Handling Rebates The hours of the position are 8:00-1:00 M-F . This is an excellent entry level growth opportunity for someone with an interest in Accounting.    Training Schedule: 9:00-2:00 pm Monday-Friday for 2 weeks (Paid Training)    Work schedules are based on business need and could include morning, afternoon, and evening hours.    Starting pay is $15.00/hr with the opportunity to bonus based on individual and team performance Desired Skills/ Experience/Attributes Proven track record of dependability and reliability Experience with a 10-key calculator, Microsoft Word and Excel preferred QuickBooks knowledge a plus Interest or experience in Accounting preferred Knowledge of bank reconciliation a plus Will be responsible for General Ledger Entries Will be responsible for Handling REBATES Generating monthly financial statements",91000,3.0
385,Graphic Designer: Fashion-driven Adobe Illustrator/Photoshop Magician,Exxon Mobil,general,kiev,"About You:You can work magic with Adobe Illustrator and PhotoshopYou have a strong interest in Women's fashion.You are passionate and driven to create good design products.You possess a storng desire to succeed.You work well under pressure.You have great attention to detail.You can work weekends and late evenings to meet deadlines, when needed.About Us:We are a fashion tech design house. We design some of the coolest apple accessories (earbuds, headphones, iPhone cases, charging accessories) on the planet. We sell to large chains and small stores around the nation (e.g. Hot Topic, Forever 21, Rue 21, Tilly's,..). We have a core group of dedicated and passionate people at our office. We are looking to add equally or more dedicated and passionate people to the team in our fast-paced office environment. Our site: #URL_eb5bf1e6ef7f5b3926d6c81df5e161fa3f564190b21ab7b91cc42f70275e7bf4#About the Job:You will be designing cool products (earbuds, headphones, iPhone cases,...) for some of the coolest retailers in the world such as Forever 21, Hot Topic, etc.You will help design packaging of new products.You will be preparing and maintaining updates to catalogs and price sheets.You will be on the constant look out for new women's fashion trends and incorporate them into our design catalogs.You will be creating production artwork for all the designs that are selected for sampling / production.You will be in charge of maintaining and updating our design database.You will be in charge of distributing new designs to our customers.You will be in charge of our website and social media accounts with new creatives on regular basis.We are a small and growing company and everybody wears a lot of hats. You will be willing to help out with other parts of the company when the help is needed.",104000,2.5
386,Graduates: English Teacher Abroad ,Amazon,Education,bucharest,"Play with kids, get paid for it :-)Love travel? Jobs in Asia$1500 USD + monthly ($200 Cost of living)Housing providedAirfare ReimbursedExcellent for student loans/credit cardsGabriel Adkins : #URL_ed9094c60184b8a4975333957f05be37e69d3cdb68decc9dd9a4242733cfd7f7##URL_75db76d58f7994c7db24e8998c2fc953ab9a20ea9ac948b217693963f78d2e6b#",118000,3.9
387,IT - Administrator ,Matrox,Education,paris,"T technical support officers monitor and maintain the computer systems and networks of an organisation. They may install and configure computer systems, diagnose hardware and software faults and solve technical and applications problems, either over the phone or in person. Depending on the size of the organisation, a technical support officer's role may span one or more areas of expertise.Organisations increasingly rely on computer systems in all areas of their operations and decision-making processes. It is therefore usually crucial to ensure the correct running and maintenance of the IT systems.IT technical support officers may be known by other job titles including help desk operators, technicians, maintenance engineers or applications support specialists. The work is as much about understanding how information systems are used as applying technical knowledge related to computer hardware or software.",94000,2.5
388,Application Developer - Salesforce,Microsoft,general,bucharest,"THE COMPANY: ESRI – Environmental Systems Research Institute (#URL_6b9c7dbc8de6a3e168e9c45ac1289630f08cb59eabb68aeaa926cdb16af18c48#)Our passion for improving quality of life through geography is at the heart of everything we do.  Esri’s geographic information system (GIS) technology inspires and enables governments, universities and businesses worldwide to save money, lives and our environment through a deeper understanding of the changing world around them.Carefully managed growth and zero debt give Esri stability that is uncommon in today's volatile business world.  Privately held, we offer exceptional benefits, competitive salaries, 401(k) and profit-sharing programs, opportunities for personal and professional growth, and much more.THE OPPORTUNITY: Application Developer - SalesforceJoin our growing team and use your Salesforce development skills to implement and maintain Salesforce solutions. This is a challenging opportunity to work with a team of analysts and other developers to solve key business systems-related problems and improve existing processes.Specifically…Design and develop Salesforce-based applications and enhancementsBuilding custom applications on the #URL_9c5f751b7ed85d808872f8eb3e558a747f92376a3c1005f6b91fe07438fe13f9# platformUnderstand and leverage the Salesforce provided APIsReview and understand business needs and requirements and create functional prototypes to address themFollow established Salesforce development standardsAssist in troubleshooting difficult technical issuesMaintain existing applications with an eye to continuous automation and improvementStay current on #URL_9c5f751b7ed85d808872f8eb3e558a747f92376a3c1005f6b91fe07438fe13f9# technology changes",118000,3.1
389,User Experience Intern,Chevron,software,new york,"VolunteerMark is a volunteer management software company that serves nonprofit organizations worldwide.  Our company helps organizations maximize the volunteer experience with our cloud tools for communication, scheduling, and reporting.  We work with service organizations, schools, businesses, nonprofits, and churches.  VolunteerMark is a software-as-a-service for web, mobile, and tablet devices.The user experience intern will help test our product and provide feedback for how to make it more user-friendly to ultimately create a more successful experience for our users.  ",110000,3.0
390,Entry Level Sales and Marketing Rep,Apple,general,paris,"Are you looking for an exciting new position and an opportunity to change your life for the better?About us:Advocate Construction is currently expanding our territory in the Chicago Area, due to this exciting growth we are now looking to offer an outstanding opportunity for the right person that is not intimidated by hard work and has what it takes to become part of a company that has increased sales year after year.As a Corporate Representative you will help Advocate Construction in our mission to help homeowners obtain much needed repairs to their homes after they have experienced damage due to a severe storm at little or no cost.Advocate Construction offers our team members the opportunity to enter our Management Trainee Program (MTP) which offers an outstanding focus on sales and business management education; this invaluable training will enable you to acquire an impressive skill set which will lead you into senior management and earn a sustainable income for many years to come.If you are seeking a long term career with unlimited potential and are interested in becoming a Corporate Representative, we invite you to contact us via email with your resume and introduction as to why you are the right person for this outstanding opportunity.",119000,3.2
391,IS Tester ,DRW,software,tokyo,"We currently have a vacancy for an IS Tester, fluent in English, to offer his/her services as an expert who will be based in Frankfurt. The work will be carried out either in the company’s premises or on site at the customer premises. In the context of the first assignment, the successful candidate will be integrated in the Quality Assurance Team of the company that will closely cooperate with a major client’s IT team on site. Your tasks:Definition of test plans and cases;Participation in the requirements’ analysis;Test execution and report production on test results;Development and execution of test scenarios and scripts;Retest defects.",112000,3.0
392,York Fragrance and Beauty Promotional Work,Matrox,general,new york,"We are currently recruiting for an exciting Sales &amp; Customer Service role. We are looking for someone with a passion for sales, beauty and fragrance who is enthusiastic and driven.The ideal candidates will have the ability to demonstrate a fresh approach to sales and be able to work in a fast paced and versatile environment.If you are looking to build your career in Beauty, Promotional work, Sales and Customer Service apply now.The role would suit anyone with the following experience:* Great communication skills* Positive attitude* Be able to hit targets and achieve goals* Be able to work in a customer facing role* The ability to build and maintain strong relationships with clients and customers* Beauty training or make up artisty* Fragrance or cosmetic counter experienceFull product training will be available to all successful candidates.",74000,2.5
393,Software Engineer,UnitedHealth Group,general,tokyo,"#URL_c914851eb385d8c6471d602008fc4e84780de02287ca6ee67080b5f24864592f# is a developers tools provider based in LasVegas and Krakow. We’re privately funded, and profitable. We already have a number of active, successful products (PandaStream, StillAlive, StatusHub,PointDNS, Statsmix, #URL_185d321c4bb13bb00e36e126a608448950d4febc526b34407ecd7725c3348442# and more) in the space.We’re looking to grow our team in Krakow now – so if you’re interested and fit the below guidelines – contact us!We are in an extraordinary age where we can take on science fiction and make it real. Why wait for someone else to invent the future when you can build it today? We are passionate about technology and the positive impacts it can bring to society.Everyone at the company takes a tremendous amount of pride in their work, following through an idea from conception to release. We have an imperative to do something truly significant, something that will leave a legacy.We make it a priority to ensure that everyone at the company is continually honing their skills and expanding their capability. You will wear many hats, and take on and conquer challenges you never dreamed of.We invest heavily in our culture – getting smart, experienced people is one challenge, getting team members that really want to participate in our project and add value to the whole, is another, and that’s what we want. We find what works best for us is:ShareCommunicating is fun, useful, and not a chore. We run multiple offices, so being able to effectively communicate through a few different channels, regularly, and without effort, is essential.Learn and coachWilling to listen, even if you think you know the answer, and willing to coach anyone who doesn’t.Nothing is impossibleBuy into the potential to do anything, even if at the first pass it looks like there’s many reasons why it won’t work.Fight and FriendlyBe willing to fight for your point of view, or say when something isn’t right – while still remaining humble.",102000,2.9
