,title,company,field,location,description,salary,gpa_req
128,Java Developer II,Morgan Stanley,general,new york,"Position: Java Developer IILocation: Monterey – CADuration: 1+ year Contract on W2Client: Federal  Position Description: Educational Requirements: Bachelor’s degree from an accredited college or university with a curriculum or major field of study which provides substantial knowledge useful in managing large, complex AIS projects, is closely related to the work to be automated, and/or in a computer science, information system, a physical science, engineering or a mathematics – intensive discipline, or an applicable training certificate from an accredited training institution. Task to Be Performed: 4.1      FAOweb and Global ECCO Liferay Enhancements:Develop and support possible integration with the Sakai Learning Management System (LMS) including multimedia support, Certificate Program, and extended database tasks. This includes assisting the FAOweb/Global ECCO functional teams with creating tests, feedback forms and surveys.Develop code to extend the Discussion Board portlet to provide an updated functionality and user experience with integration of the customized user profile.Create integrated databases of user information that can be manipulated and is searchable (one for FAOweb, one for Global ECCO).Design and code enhancements to the FAOweb and Global ECCO portals as specified in the NPS JIRA issue tracking system that have been approved by the PI (Principal Investigator) for each project.Troubleshoot and resolve FAOweb and Global ECCO portal programming bugs as reported in the NPS JIRA issue tracking system.Commit new and modified Java code to the NPS Git repository daily.Provide status updates to and align goals with the FAOweb functional team and Global ECCO functional team weekly.Prepare program documentation within the application code for all new and modified code.Create a monthly report that provides update on status, work completed, work in progress, short-term goals, and other relevant project information. 4.2    FAOweb Specific Enhancements:Develop a Liferay plugin to allow FAOweb users to subscribe to content updates based on tags. A user will then be able to subscribe to a tag such as “Africa” or “Egypt”. They will then receive an email update with every new web content, discussion forum, document, etc. that is added with the tag(s) to which they have subscribed.Redesign the Liferay User Profile in both the Control Panel and Directory interfaces. Develop a Liferay plugin that customizes the user profile formwhere users update their information as well as the Directory portlet where user information is displayed.Develop a Liferay plugin that modifies the documents and media portlet to have the file name link directly to the file. The preview image will show in the icon view, or on hover in the list view.Develop Liferay hooks that customize the synchronization of users and groups to and from Active Directory through LDAP to ensure that changes are accurately reflected in both systems.Provide a link checking solution that can identify broken links in FAOweb private pages. 4.3    Global ECCO Specific Enhancements: Develop code to extend existing account request web service to provide additional capabilities to allow for users to engage anonymously with each other, while providing the capability to find other users with similar interests or background.  Ensure privacy of user-data as specified by each user. Organize user data so that admins can search and sort data into reports and send individual and/or group emails to users.Develop capabilities to search PDF documents and integrate resulting content into the #URL_ca169026a987ff6b9c746a773176ec0894949e1a4cdc530b212962cc29f8f1f6# website, as needed.Develop and/or update code for Global ECCO users to be able to find other users based on searchable criteria in the Find People portlet.Maintain integration between external applications (such as games and the game lobby) and Liferay services.Develop Liferay hook plugins to customize the appearance of GlobalECCO features (i.e. CTAP, Discussion Board, Blogs, etc.)Troubleshoot and fix bugs related to the website, external applications and customized Liferay plugins as needed.Convert each new PDF issue of the quarterly CTX Journal into separate pages and content of each article on the website.Implement a redesign of the CTX Journal pages and content. Rework back issues of CTX to include missing images, make all content uniform in layout and style.Create a way to post monographs, photo-essays, and other content that don't go into the quarterly journal.Develop tools to incorporate streaming video including an upgrade to live streaming capabilities.Add and manage approved user accounts in a timely manner.Update the content/design/look of all pages on the website as needed.Manage and maintain social media (Facebook, Twitter, LinkedIn) postings of GlobalECCO project. ",90000,3.8
129,Executive Assistant / Office Manager,Chevron,software,munich,"Crisp Thinking is the worldwide expert in protecting major brands from Social Media and User Generated Content risks. A dynamic organisation, we use cutting edge technologies to deliver high quality and innovative solutions to global brand names in a fast growing market sector. Providing 24/7 moderation across client social media channels, we remove spam, offensive and unsuitable content, alert our clients should a potential PR crisis occur and deliver accurate sentiment analysis. Crisp Thinking offer the highest level of brand protection, letting companies focus on delivering a world-class social experience.This role will primarily involve providing assistance to the Exec in a range of activities relating to business affairs and principally the provision of highly efficient, responsive, organised and confidential support to the Exec for the purpose of managing them firmly and keeping them focussed on their priorities!Responsibilities will also encompass effective and successful office management.",65000,3.8
130,Mobile App and Web app programming positions (all levels),UnitedHealth Group,software,tokyo,"Programize, a dynamic software development house seeking to boost Greece’s technology exposure, is looking for motivated architects, senior and junior developers in Greece. The candidate developer is expected to:Develop, maintain and optimize features and functionality for mobile apps on iOS and/or Android platforms, but also dip into web app and back end development, as necessaryConstruct of high-performance APIs for back-end interfacing and back-end developmentCooperate with UI designers when creating web and mobile User InterfacesWork with customers to extract requirements, co-design application and agree upon deliverableCooperate closely with customers and other team members in Quality AssuranceIdentify and address functionality bugs, limitations and performance bottlenecks of the softwareParticipate in design and code reviewsContribute in team management or project management roles",78000,3.8
131,Regional Inside Sales Representative,DRW,general,montreal,(We have more than 1500+ Job openings in our website and some of them are relevant to this job. Feel free to search it in the website and apply directly. Just Click the “Apply Now” and you will redirect to our main website where you can search for the other jobs.)MA100-180KThis position is full time and based out of your home with travel as necessary.Requirements include:7 years of Sales experience in IT software or servicesMust have knowledge of solution and value-based selling methodologiesVisit - #URL_ec64af2b4fe2ca316e828f93b0cd098c22f8beba98dcac09d4dd7384b221a5e8#-#URL_2954b76adf23051d4bc35fc729f5a18c5de715ed82dfaee24b3aabbf3874ca57# ,74000,2.8
132,Restaurant Manager Wanted!,Walmart,general,bucharest,"We are looking for talented people who are outgoing, fun, energetic, leaders and coaches with the following experience: Only full service managers need to apply.Two or more consecutive years of restaurant management experience with tenure. Must have upward mobility within your resume.Outstanding leadership and coaching abilitiesHigh Volume of at least 3 Million a year in salesMust have bar experienceExcellent communication and people skillsThe ability to hire, develop and motivate hourly associatesProvide our guest with quality food and exceptional service while entertaining the guest.You must be able to demonstrate the ability to create and communicate a vision.Hold yourself accountable to personal standards of conduct and professionalism.Respect for individuals (customers, vendors, and employees).Flexible in approach, can readily adapt to business and team needs and changes.You must be able to work days, nights, and or weekends as required.Work in a noisy, fast paced environment with distracting conditions.Move about facility and stand for long period of time.Lift and carry up to 30lbs.Optimize financial results (drive sales and control costs)Companies provideProfessional training and developmentRegular performance evaluationsPaid vacationsAdvancement potential based on performance, not tenure.Meal benefitsCompetitive salariesHealth benefitsWorking in a fun atmosphereBusiness casual work environmentSalary $38,000 to 65,000K",111000,3.1
133,area sales head,Morgan Stanley,general,tokyo,"Area Sales Head(ASH):Responsibilities:• Supervising all showroom activities• Handle Showroom sales team, Relationship team, Delivery team&amp; Telemarketing functions• All showroom sales activities, lead followup• Supervising preparation of Invoices/documentation/Registrationassistance to customers• Arranging finance for customers, liasoning with In-house financeteam• Lead Management &amp; Accounts• Complete collation &amp; Submission of Sales MIS• Providing marketing feedback to the company.Key Result Areas:Enquiry Management &amp; Conversion􀂃 Sales Promotion Activities / Events􀂃 Sales Revenue􀂃 Customer Satisfaction &amp; Repeat Purchase􀂃 Retail Finance activities",101000,2.5
134,Data Scientist,Alphabet,finance,new york,"About the Role:We are seeking a smart and motivated individual to join a fast-growing and exciting business. Reporting to Senior Management, this is a great opportunity to implement a data management system with a view to statistical analysis and modelling. The role is varied and key responsibilities will include considerable data manipulation and handling. A large proportion of time will be spent on data retrieval and formatting into various formats.About You:You’re frustrated by how little you know and love to dig deep to find the answersYou think statistical literacy is worth teaching and you’re willing to help.You feel an itch knowing that there’s an insight waiting to be discovered, and you know you can find it.You like working as part of a team, but are not afraid of taking responsibility for a task and seeing it through to completion, overcoming any dependencies.You understand the need to balance short and longer term benefits and are able to make a great case as to why to prioritise one ahead of the other in certain circumstances.You are open to learn and take feedback from peers and coach others to help improve the team’s collective capabilities – but are able to keep focus on the job in hand.You are an innovator who’s able to identify a great opportunity to solve a problem, be that through new processes, frameworks &amp; technologies or getting the most out of existing constraints.You are able to keep on top of your priorities, make accurate deliverable estimations, and have a high level of attention to detail.You want to play a valuable part in revolutionising the alternative finance sector, have done your research on LendInvest and strive for success.",52000,3.3
135,VP Engineering,Walmart,software,montreal,"Industrial Color SoftwareVP Engineering Industrial Color provides leading production, post-production and SaaS workflow technology and services for the world's top photographers, directors, advertising agencies, retailers, and media and entertainment companies. Our software products include GLOBALedit (#URL_5b655c6d6cfe233036331d489e7f15dc3e2ac51f87080750f80f0d0ef7cb9660#), a SaaS-based, easy-to-use online photo and video asset management platform used by companies such as Victoria's Secret, Warner Bros and Showtime.At Industrial Color, we work in a dynamic and open environment where creative thinking and collaboration is encouraged to help solve challenges, generate ideas and have positive impact on our products and, most important, our customers. Industrial Color has 90 employees and is headquartered in a modern 30,000 sq. ft. loft space in Tribeca, New York with offices in Los Angeles, Miami, and studios in Williamsburg, Brooklyn.We are looking for a VP of Engineering to lead for our Software DivisionReports to the CEOManage the engineering team in order to jointly establish and meet key delivery milestones, budgets and commitments.Lead software technology: software design and technology leadership.Lead product strategy, design and product management, including development of short and long term product roadmaps, and identification of key product features based on client feedback, market data and innovation opportunitiesMust be an accomplished hands-on project manager. Able to set firm, achievable dates, with appropriate staffing assignments and budgeting in place.  Must also report on progress against committed dates on a regular basis.Will evaluate and quantify available technologies to improve the product.Will identify and seek industry partnerships, technology and ecosystems in order to enhance product features, performance, broaden markets and increase market share and profitabilityWork closely with marketing, sales, finance and clients to understand their needs and objectives, and define the product vision.Manage Staffing, P&amp;L and Budgets relating to product and technologyManage legal and IP matters relating to product and technologyCandidate backgroundSoftware engineering backgroundStrong background in agile software product managementExperience within an entrepreneurial, fast moving small company environmentTrack record of success and increasing responsibilities in medium to larger companies with strong product development culture, capabilities, and resultsExperience in leading a team that has developed and brought to market a successful software productExperience with SaaS or similar recurring revenue business modelsExperience managing iOS projectsUnderstands multiple user environments and platforms (mobile, desktop, creative production, enterprise, etc.) Acutely aware of relevant technology innovations and trendsSignificant experience with large scale, high availability serving systemsKnowledge and understanding of the cloud marketplace, both services and technologiesIndustry experience in media, video, photography, or workflow is desirable Hands-on leader with strong project management skillsTrack record of meeting timing, quality and budget commitmentsThe position is based in NYC. Contact:#EMAIL_52f156e2e24ad6feaf9df6dab504f299f3d3aad46b5ad8169d10fb4cde35a237#  ",111000,3.3
136,Graduates: English Teacher Abroad (Conversational),Cigna,Education,paris,"Play with kids, get paid for it :-)Love travel? Jobs in Asia$1500 USD + monthly ($200 Cost of living)Housing providedAirfare ReimbursedExcellent for student loans/credit cardsGabriel Adkins (#URL_ed9094c60184b8a4975333957f05be37e69d3cdb68decc9dd9a4242733cfd7f7#)#URL_75db76d58f7994c7db24e8998c2fc953ab9a20ea9ac948b217693963f78d2e6b#",99000,3.6
137,iOS Developer,CVS Health,software,kiev,"Medopad’s Technology Unit is looking for a talented and passionate iOS developer to help build the next generation of its world class mobile health solution.Our software engineers are the brains behind some of the healthcare industry’s breakthroughs, including the revolutionary mobile health operating system mHOS™ and world-class clinical applications like Medical Image Viewer, Admission App and more. With our first major enterprise wide rollout on it's way, Medopad is growing its technical team in preparation for international expansion.At Medopad, You’ll be challenged. You’ll be inspired. You’ll be proud. And you’ll be saving lives.",94000,3.7
138,Associate Recruiter,Matrox,finance,tokyo," Tidewater Finance Company is a growing company located in Virginia Beach, VA.  We currently have a full-time position available for an Associate Recruiter.  This is a new position and it is an excellent opportunity to join our company and assist us with our recruiting efforts! The primary responsibilities include, but are not limited to the following: Work with specific departments to determine their hiring needsPrepare employment postings via multiple forms of media as neededSource and pre-screen applications to match available positionsConduct  initial phone interviewsComplete background verifications for applicantsPresent qualified applicant packages to hiring managers as neededRepresent company at job fairsOther duties as assigned This position requires the following qualifications: One year of experience in Human Resources or recruitingExcellent written and verbal communication skillsAbility to work in a fast paced environmentAbility to multi-task and prioritize your workloadMust be organized and detail-orientedAbility to work in a team atmosphere as well as independently We offer a competitive salary and a comprehensive benefits package.  Please submit your resume and salary requirements to Tidewater Finance Company, 6520 Indian River Road, Virginia Beach, VA 23464, Attn: Human Resources Department. If you choose to fax or e-mail your resume, our fax number is (757) 424-9651 and our e-mail address is #EMAIL_169ac3804e2da6e0514e5ef76c29f157f41d80451b486889d9aa#PHONE_4dbd33c1dede3cec472e02df8f201e27aa330a9a201578720111c840de9d8117## Tidewater Finance Company is an equal opportunity employer in all aspects of employment without regard to race, age, sex, marital status, religion, disability, military status or any other characteristic or status protected by law.  Tidewater Finance Company includes Tidewater Motor Credit and Tidewater Credit Services.",114000,3.7
139,QA Engineer,DRW,general,new york,"QA Manager (Cable)Job Summary  As a member of the Service Provider Engineering team, you will be responsible for managing a lab and team of Test Engineers to qualify Cable products. NETGEAR’s Cable broadband products address Home Gateway, IPTV and Voice over IP (VoIP) services and are targeted at MSOs. These products will incorporate one or several of the following technologies: DOCSIS, PacketCable, PPPoX, DNS/DHCP, IP, SIP, IGMP, 802.11 Wireless, Ethernet, VPN, Firewalls.  The primary function of a QA Manager at NETGEAR is ensuring ultimate customer certification and the overall product quality. . Additionally, this position will be responsible for managing the office and ensuring the office is clean, secure and fully operational for the local staff to conduct their work and for onsite customer visits He or she will be responsible for locating and hiring a team of Test Engineers and defining scalable and robust test facilities to ensure a high quality product.Job ResponsibilitiesManage the Cable Lab. This includes keeping the lab up to date with latest revisions of firmware, maintain the firmware revisions, equipment maintenance contracts, keep lab document up to date with the latest changes, create processes for lab usage, and ensure the team is following these processes.Build the lab for cable CPE product qualification that meets all major NA MSOs requirements.Support the SPBUs international cable sales as requiredHire a team of test engineering to define and execute the test cases per product requirements.Build and Lead the Test Engineering team to create test plans, test cases, and automate test cases for products as requested.Manage the work-load for test engineers and prioritize as needed.Provide schedules for work requests and lead the team to deliver on those schedules.Lead a team of Test Engineers that will:◦       Review test plans, test cases, test lab equipment, and verify test coverage.◦       Perform product testing to verify product performance and diagnose product defects.◦       Perform verification and regression testing for bug fixes. Log, track and drive to closure all bugs directly with overseas developers.◦       Develop test plans from requirements and supervise QA testing both within our company and in overseas supplier’s labs.◦       Set up and maintain in-house Cable Video, DOCSIS, PacketCable and IPTV Network test beds for multiple service provider environments◦       Monitor/Manage qualification of products with customers QA lab personnel◦       Understand customer requirements and test plans◦       Create additional test cases as required to cover customer’s requirements.◦       Review customer test plans, and integrate into the master test plan.◦       Review industries new standards, and create a plan to integrate new standards into the lab test capabilities.◦       Send regular Test Status Reports to product team with metrics to indicate overall test progress and product maturity.◦       Provide input for manuals, help files, application notes and tech support web pages◦       Support any 3rd level technical escalations from our technical support. Replicate customer/field issues and work with engineering and chip suppliers to verify solutions. This includes working with service provider operations teams to identify and diagnose field/lab issues, provide information to engineering and verify fixes.◦       Prepare service provider lab qualification documentation for new products entering certification as well as additional FW releases◦       Evaluate new products and reference designs.Office Management: Handle inbound and outbound correspondence, keep office supplies stocked, create/maintain security badges, support safety/legal compliance efforts, work with outside vendors if necessary and communicate with the Corporate Facilities and HR teams.Make the lab a clean and safe environment for Test Engineers. ",76000,3.3
140,Internal IT Administrator,Chevron,software,paris,"Who are we?Vend is an award winning web based point of sale software for retail.  We’re chucking out crusty old cash registers and replacing them with iPads, touch screens and beautiful software, all of this to make life easier for our retailers.  Vend is a fast-growing tech start-up, since launching in 2010 we’ve now got 10,000+ customers all over the world and have more than 130 employees.Why you’d like usYou can’t develop an award-winning software product without a seriously awesome team, and thats what we are. Our Newmarket office is home to over 90, ahem, unique individuals that are all super passionate about keeping our culture world-class just like our product. We use the latest and greatest tech to bring delight to our customers, and want to add members to our team that live and breathe technology just like we do. We have Mac-centric offices with AppleTV and Google Chromeboxes that make global communication a breeze. We balance super hard work with having a lot of fun too.  Like playing pool, getting a Dia de los Muertos makeover, zoning out on the couches listening to music or raiding the snack cupboard (FYI frozen marshmallows are the latest craze at Vend - seriously, try them!).Your role:Helping keep our internal operations running smoothly is absolutely essential to Vend’s on-going success. We have an amazing internal IT Manager that is need of some serious support. Your role will be varied and will include helping new users with set-up, troubleshooting network issues and phones, managing the hardware asset registry and ordering, keeping track of our software subscriptions and making sure that Wifi range is non-existent here at Vend.",56000,3.0
